{
  "schema_version": 1,
  "id": "hensun-emote-lab-v1",
  "mode": "emote-lab",
  "provisioning": "softap",
  "wake": {
    "enabled": false,
    "command": "",
    "display_name": "",
    "threshold": 25,
    "model": "none"
  },
  "features": {
    "send_wake_word_data": false,
    "emote_engine": true,
    "one_shot_conversation": false,
    "camera": true,
    "cloud_vision": false
  },
  "partition": {
    "custom": true,
    "file": "partitions/v2/16m_hensun_emote_lab.csv",
    "model_max_bytes": 3129344,
    "emote_max_bytes": 5242880
  },
  "bootstrap": {
    "strategy": "build-parameter",
    "fixed_url": ""
  }
}
